FkkoCode,FkkoDescription,collection,disposal,placement,processing,transportation,utilization
36351813394,Воды мойки окрасочных камер от красителей на водной основе,1,1,1,1,1,0
36351814203,Отходы зачистки решеток окрасочных камер,0,0,0,0,0,0
36351911404,"Зола от термической обработки металлических изделий, загрязненных порошковой краской",0,0,0,0,0,0
36352000000,Отходы нанесения антикоррозионных покрытий на металлические поверхности,0,0,0,0,0,0
36352111494,Отходы очистки камер нанесения на металлические поверхности антикоррозионного покрытия на основе полимочевины,0,0,0,0,0,0
36352121424,Отходы сухой газоочистки при напылении порошка эпоксидной смолы на металлические поверхности,1,1,1,1,1,0
36352211404,Отходы при шликеровании и нанесении антикоррозионного силикатно-эмалевого покрытия на металлические поверхности,1,1,1,1,1,0
36352311204,Отходы очистки камер при распылении фторопластовых покрытий на металлические поверхности,0,0,0,0,0,0
36352312203,Отходы фторопласта при нанесении фторопластовых покрытий на металлические поверхности,0,0,0,0,0,0
36352313614,"Фильтры бумажные отработанные, загрязненные фторопластом при распылении фторопластовых покрытий на металлические поверхности",0,0,0,0,0,0
36352317424,Пыль (порошок) от полировки фторопластовых покрытий металлических поверхностей,0,0,0,0,0,0
36353000000,Отходы нанесения на металлические поверхности лакокрасочных покрытий методом окунания (погружения),0,0,0,0,0,0
36353111393,Отходы лакокрасочных материалов при нанесении лакокрасочных покрытий на металлические поверхности методом окунания (погружения),0,0,0,0,0,0
36358000000,Отходы очистки сточных вод обработки металлических поверхностей методом нанесения органических покрытий,0,0,0,0,0,0
36358111334,"Осадок нейтрализации известковым молоком сточных вод обработки металлических поверхностей методом нанесения органических покрытий, содержащий преимущественно кремний, железо и алюминий, обезвоженный",1,1,1,1,1,0
36360000000,Отходы прочей электрохимической обработки металлов,0,0,0,0,0,0
36361000000,"Отходы при анодно-гидравлической обработке металлов (копирование, прошивание, калибрование, удаление заусенцев и т.д.)",0,0,0,0,0,0
36361100000,Электролиты анодно-гидравлической обработки металлов отработанные,0,0,0,0,0,0
36361101103,Электролит анодно-гидравлической обработки металлов на основе нитрата натрия отработанный,1,1,1,1,1,0
36361200000,Осадки ванн анодно-гидравлической обработки металлов,0,0,0,0,0,0
36361201393,Осадок ванн анодно-гидравлической обработки металлов в электролите на основе нитрата натрия,1,1,1,1,1,0
36362000000,"Отходы при анодно-механической обработке металлов (резка, затачивание, фрезерование, точение и т.д.)",0,0,0,0,0,0
36363000000,Отходы при электроабразивной (электроалмазной) обработке металлов,0,0,0,0,0,0
36381000000,"Растворы технологические, отработанные при обработке поверхности металлов и нанесения покрытий на металлы, в смеси",0,0,0,0,0,0
36381111102,"Смешанные стоки обработки поверхности металлов и нанесения покрытий на металлы, содержащие неорганические фосфаты, сульфаты, соединения кадмия",0,0,0,0,0,0
36381211102,"Смешанные стоки обработки поверхности металлов и нанесения покрытий на металлы, содержащие преимущественно соединения хрома",0,0,0,0,0,0
36381311102,"Смешанные стоки обработки поверхности металлов и нанесения покрытий на металлы, содержащие преимущественно карбонаты и цианиды щелочных металлов",0,0,0,0,0,0
36382000000,Отходы зачистки ванн при обработке поверхности металлов и нанесения покрытий на металлы в смеси,0,0,0,0,0,0
36382111332,"Отходы зачистки ванн обработки поверхности металлов и нанесения покрытий на металлы в смеси обезвоженные, содержащие преимущественно соединения тяжелых металлов, неорганические фосфаты, сульфаты",0,0,0,0,0,0
36382211332,"Отходы зачистки ванн обработки поверхности металлов и нанесения покрытий на металлы в смеси обезвоженные, содержащие преимущественно соединения титана, железа, хрома",0,0,0,0,0,0
36382311332,"Отходы зачистки ванн обработки поверхности металлов и нанесения покрытий на металлы в смеси обезвоженные, содержащие неорганические цианиды, соединения хрома, железа",0,0,0,0,0,0
36382511334,Осадок при щелочной и сульфидной обработке водной суспензии смеси отходов зачистки ванн обработки поверхности металлов обезвоженный,0,0,0,0,0,0
36383000000,"Отходы обезвреживания растворов, отработанных при обработке поверхности металлов и нанесения покрытий на металлы",0,0,0,0,0,0
36383111334,"Осадок обезвоженный смеси обезвреженных (кислотно-щелочных, хромсодержащих, циансодержащих) растворов, отработанных при обработке поверхности металлов и нанесения покрытий на металлы",0,0,0,0,0,0
36390000000,Отходы прочих видов обработки поверхности металлов и нанесения покрытий на металлы,0,0,0,0,0,0
36391000000,"Отходы обработки металлических поверхностей методом нанесения газотермического напыления (плазменного, детонационного, газопламенного)",0,0,0,0,0,0
36391111424,"Пыль газоочистки при газодинамическом напылении порошков на металлические поверхности, содержащая преимущественно олово и алюминий",0,0,0,0,0,0
36391211413,Отходы порошка на основе никеля при плазменном напылении на металлические поверхности,0,0,0,0,0,0
36392000000,"Отходы обработки металлических поверхностей методом нанесения вакуумного напыления (вакуумно-плазменного, электронно-лучевого)",0,0,0,0,0,0
36394000000,Отходы обработки металлических поверхностей методом полирования,0,0,0,0,0,0
36394200000,Отходы обработки металлических поверхностей методом электрохимического полирования,0,0,0,0,0,0
36394261103,Растворы и электролиты отработанные в смеси при обработке металлических поверхностей методом электрохимического полирования на основе серной и фосфорной кислот,0,0,0,0,0,0
36394300000,Отходы обработки металлических поверхностей методом электролитно-плазменного полирования,0,0,0,0,0,0
36394311104,Электролит электролитно-плазменного полирования на основе сульфата аммония отработанный,1,1,1,1,1,0
36395000000,Отходы обработки металлических поверхностей методом оксидирования,0,0,0,0,0,0
36395100000,Отходы обработки металлических поверхностей методом химического оксидирования,0,0,0,0,0,0
36395120000,Осадки ванн химического оксидирования металлических поверхностей,0,0,0,0,0,0
36395121393,Осадок ванн щелочного химического оксидирования поверхностей черных металлов,1,1,1,1,1,0
36395150000,"Растворы химического оксидирования металлических поверхностей отработанные, содержащие хромовый ангидрид",0,0,0,0,0,0
36395151102,"Растворы на основе хромового ангидрида и фосфорной кислоты, отработанные при химическом оксидировании алюминиевых поверхностей",1,1,1,1,1,0
36395152103,"Растворы на основе хромового ангидрида и железосинеродистого калия, отработанные при химическом оксидировании металлических поверхностей",1,1,1,1,1,0
36395200000,Отходы обработки металлических поверхностей методом электрохимического оксидирования,0,0,0,0,0,0
36395211103,Электролит электрохимического оксидирования металлических поверхностей на основе хромовой кислоты отработанный,0,0,0,0,0,0
36395221102,Электролит электрохимического оксидирования металлических поверхностей на основе серной кислоты,0,0,0,0,0,0
36395261103,Растворы и электролиты отработанные в смеси при обработке металлических поверхностей методом электрохимического оксидирования на основе серной кислоты,1,1,1,1,1,0
36395350000,"Отходы обезвреживания отработанных растворов химического оксидирования металлических поверхностей, содержащих хромовый ангидрид",0,0,0,0,0,0
36395351203,Осадок обезвреживания сульфатом железа (ii) растворов химического оксидирования алюминиевых поверхностей на основе хромового ангидрида и фосфорной кислоты обезвоженный,1,1,1,1,1,0
36396000000,Отходы обработки металлических поверхностей методом диффузионной металлизации,0,0,0,0,0,0
36396111493,Отходы обработки металлических поверхностей методом термодиффузионного цинкования,1,1,1,1,1,0
36397000000,Отходы обработки металлических поверхностей методом погружения в расплав,0,0,0,0,0,0
36397111203,Отходы очистки зеркала расплава свинца при горячем свинцевании металлических поверхностей,0,0,0,0,0,0
36397120000,Отходы при горячем цинковании металлических поверхностей,0,0,0,0,0,0
36397121203,Отходы очистки зеркала расплава цинка при горячем цинковании металлических поверхностей,0,0,0,0,0,0
36397122203,Отходы зачистки ванн цинкования при горячем цинковании металлических поверхностей,1,1,1,1,1,0
36397131203,Отходы очистки зеркала оловянно-свинцового расплава при лужении металлических поверхностей,0,0,0,0,0,0
36397132203,Отходы очистки зеркала расплава свинца при лужении металлических поверхностей,0,0,0,0,0,0
36397421103,"Растворы на основе соляной кислоты, отработанные при удалении цинковых покрытий с металлических поверхностей",0,0,0,0,0,0
36397531204,Отходы очистки древесными опилками от примесей металлов оловянно-свинцового расплава лужения металлических поверхностей,0,0,0,0,0,0
36397600000,Отходы газоочистки при обработке металлических поверхностей методом погружения в расплав,0,0,0,0,0,0
36397621423,Пыль газоочистки цинксодержащая при горячем цинковании металлических поверхностей,0,0,0,0,0,0
36398111204,Отходы при очистке ванн карбонитрации металлических поверхностей,0,0,0,0,0,0
36399281203,Отходы зачистки ванн химической обработки (очистки) металлических поверхностей в расплаве на основе гидроксида и солей натрия,0,1,0,0,0,0
36600000000,Отходы производства прочих готовых металлических изделий,0,0,0,0,0,0
36610000000,Отходы производства металлических бочек и аналогичных емкостей,0,0,0,0,0,0
36612000000,Отходы производства тары металлической легкой,0,0,0,0,0,0
36612331203,Отходы цинксодержащие при пайке корпуса консервной банки с использованием флюса на основе хлорида цинка,0,0,0,0,0,0
36630000000,"Отходы производства изделий из проволоки, цепей и пружин",0,0,0,0,0,0
36634111203,Отходы (остатки) нихромовой проволоки при изготовлении нихромовой спирали,0,0,0,0,0,0
36635121294,Остатки обмазочной смеси при отмывке бракованных электродов в производстве электродов,0,0,0,0,0,0
36635131104,Воды промывки технологического оборудования производства сварочных электродов,0,0,0,0,0,0
36900000000,Прочие отходы при производстве готовых металлических изделий,0,0,0,0,0,0
36970000000,Отходы газоочистки при производстве готовых металлических изделий,0,0,0,0,0,0
36975111424,Пыль газоочистки при производстве электродов сварочных,0,0,0,0,0,0
36980000000,Отходы очистки производственных сточных вод при производстве готовых металлических изделий,0,0,0,0,0,0
36985111394,"Осадок механической очистки производственных сточных вод, загрязненных бериллием, содержащий преимущественно диоксид кремния",0,0,0,0,0,0
37000000000,Отходы производства машин и оборудования,0,0,0,0,0,0
37100000000,"Отходы производства компьютеров, электронных и оптических изделий",0,0,0,0,0,0
37110000000,Отходы производства элементов электронной аппаратуры и печатных схем (плат),0,0,0,0,0,0
37111000000,Отходы производства элементов электронной аппаратуры,0,0,0,0,0,0
37111151103,"Раствор смеси азотной и фтористоводородной кислот, отработанный при обработке кварцевых реакторов в производстве элементов электронной аппаратуры",0,0,0,0,0,0
37111200000,"Отходы производства диодов, транзисторов и прочих полупроводниковых приборов, включая светоизлучающие диоды, пьезоэлектрические приборы и их части",0,0,0,0,0,0
37111231394,"Отходы механической обработки кварца при изготовлении изделий пьезоэлектроники, содержащие нефтепродукты (содержание нефтепродуктов менее 10%)",0,0,0,0,0,0
37111235204,Отходы серебра при металлизации поверхности изделий пьезоэлектроники,0,0,0,0,0,0
37111241602,"Отходы текстильных изделий из хлопчатобумажного волокна, загрязненных мышьяком при ионном легировании в производстве базовых матричных кристаллов",0,0,0,0,0,0
37111251103,"Воды, содержащие галогенированные растворители, при промывке пьезоэлементов",0,0,0,0,0,0
37111252103,"Растворители нефтяного происхождения, загрязненные фоторезистом при промывке керамических диэлектриков",0,0,0,0,0,0
37111253102,"Отходы ацетона, загрязненные фоторезистом при фотолитографии в производстве полупроводниковых приборов",0,0,0,0,0,0
37111254102,"Отходы смеси диметилформамида и моноэтаноламина, загрязненные фоторезистом при фотолитографии в производстве полупроводниковых приборов",0,0,0,0,0,0
37111255103,"Диметилформамид обводненный, загрязненный фоторезистом при обезжиривании и промывке поверхности полупроводниковых пластин и удалении фоторезиста",0,0,0,0,0,0
37111256103,"Отходы смеси ацетона, изопропилового спирта, диметилформамида, загрязненные фоторезистом при отмывке пластин и оснастки в производстве полупроводниковых материалов",0,0,0,0,0,0
37111751324,Жидкие отходы промывки трубопроводов технологических стоков производства пьезокерамики на основе цирконата-титаната свинца,0,0,0,0,0,0
37111781204,"Отходы зачистки оборудования приготовления суспензии пресс-порошка в производстве пьезокерамических деталей, содержащие преимущественно оксиды кальция, кремния, алюминия",0,0,0,0,0,0
37111821404,"Отходы порошка при закалке пьезокерамических деталей в их производстве, содержащие преимущественно оксиды кальция, кремния, алюминия",0,0,0,0,0,0
37111831723,Отходы пьезокерамических материалов и пьезоэлементов на основе цирконата-титаната свинца в смеси при их производстве,0,0,0,0,0,0
37112000000,Отходы производства электронных печатных плат,0,0,0,0,0,0
37112111393,Осадок нейтрализации известковым молоком отработанных растворов и промывных вод производства печатных плат,1,1,1,1,1,0
37112112393,Осадок нейтрализации сточных вод производства печатных плат,1,1,1,1,1,0
37112211103,Растворы перманганатные травления печатных плат отработанные,1,1,1,1,1,0
37112221102,Растворы щелочные травления печатных плат отработанные,1,0,0,0,0,0
37112222323,"Растворы слабощелочные, отработанные при производстве печатных плат",1,1,1,1,1,0
37112231104,Воды промывки печатных плат после их химической и гальванической обработки,1,1,1,1,1,0
37112241102,"Моноэтаноламин, отработанный при промывке медных печатных плат в производстве печатных плат",0,0,0,0,0,0
37112242103,"Отмывочная жидкость на водной основе, отработанная при отмывке печатных плат",0,0,0,0,0,0
37112243103,"Спирт этиловый, загрязненный канифолью при обезжиривании печатных плат после пайки в их производстве",0,0,0,0,0,0
37112244104,"Воды промывки печатных плат, нейтрализованные раствором едкого натра, при производстве печатных плат",0,0,0,0,0,0
37112311393,Отходы гидроабразивной обработки печатных плат в их производстве,0,0,0,0,0,0
37112411204,Отходы затвердевшего компаунда на основе эпоксидной диановой смолы при комплектовании микросхем и печатных плат,0,0,0,0,0,0
37112431303,Отходы фоторезиста при изготовлении фоторезистивной маски на микрополосковых платах в производстве печатных плат,0,0,0,0,0,0
37112432204,Обрезки фоторезиста при нанесении фоторезиста на заготовки печатных плат в их производстве,0,0,0,0,0,0
37112511203,Обрезки стеклотекстолита при производстве печатных плат,0,0,0,0,0,0
37112512603,"Обтирочный материал, загрязненный свинцом и оловом при изготовлении печатных плат",0,0,0,0,0,0
37112611203,"Уголь активированный, отработанный в производстве печатных плат",0,0,0,0,0,0
37112711423,Пыль стеклотекстолита от газоочистки производства печатных плат,0,0,0,0,0,0
37112721393,Отходы зачистки газоочистного оборудования при производстве печатных плат,0,0,0,0,0,0
