FkkoCode,FkkoDescription,collection,disposal,placement,processing,transportation,utilization
31399111393,"Маточные растворы фильтрации продукции производств производных аминокислот, карбоновых кислот и пиримидина в смеси",0,0,0,0,0,0
31399112393,"Маточные растворы фильтрации продукции производств производных гетероциклических кетонов, карбоновых кислот и глюкамина в смеси",0,0,0,0,0,0
31399113204,"Уголь активированный, отработанный в процессе очистки продуктов производных гетероциклических кетонов, аминокислот, карбоновых кислот, глюкамина и пиримидина в смеси",0,0,0,0,0,0
31399121103,Жидкие отходы производств анилина и ксантогенатов в смеси,0,0,0,0,0,0
31399122103,"Смесь прудовая жидких отходов производств анилина, сероуглерода, полупродуктов и серосодержащих производных ароматических аминов, низкомолекулярных спиртов",0,0,0,0,0,0
31399124103,"Смесь изопропанола и диэтилового эфира, отработанная при производстве карбоксиангидридов аминокислот",0,0,0,0,0,0
31399131403,"Смесь углей активированных, отработанных при производстве метионина, сероуглерода и получении полупродуктов в производстве анилина",0,0,0,0,0,0
31399541604,"Ткани фильтровальные из синтетических волокон, отработанные при фильтрации метионина и ксантогенатов в их производствах",0,0,0,0,0,0
31399651334,Отходы зачистки емкостей накопления кубовых остатков и сточных вод органических производств в смеси с преимущественным содержанием оксидов кремния и железа,0,0,0,0,0,0
31400000000,Отходы производства удобрений и азотных соединений,0,0,0,0,0,0
31400100000,Отходы получения вспомогательных материалов и реагентов при производстве удобрений и азотных соединений,0,0,0,0,0,0
31400111394,Отходы получения магнезиальной добавки в производстве минеральных удобрений,0,0,0,0,0,0
31400112394,Осадок фильтрации нитрата магния при его получении и регенерации в производстве минеральных удобрений и азотных соединений,0,0,0,0,0,0
31400117604,"Ткань фильтровальная из синтетических волокон, отработанная при фильтрации магнезиальной добавки в производстве минеральных удобрений и азотных соединений",0,0,0,0,0,0
31400200000,Отходы хранения и транспортирования вспомогательных материалов и реагентов при производстве удобрений и азотных соединений,0,0,0,0,0,0
31400281394,Отходы чистки емкостей хранения нитрата кальция при производстве минеральных удобрений,0,0,0,0,0,0
31410000000,"Отходы производства кислоты азотной, кислот сульфоазотных, аммиака",0,0,0,0,0,0
31412000000,Отходы производства кислоты азотной,0,0,0,0,0,0
31412021234,"Ткань фильтровальная из полимерных волокон, отработанная при очистке технологических газов производства слабой азотной кислоты",1,1,1,1,1,0
31412022604,"Ткань фильтровальная из синтетических волокон, отработанная при очистке аммиачно-воздушной смеси производства азотной кислоты",0,0,0,0,0,0
31413000000,Отходы производства кислот сульфоазотных,0,0,0,0,0,0
31414000000,Отходы производства аммиака,0,0,0,0,0,0
31414311494,"Уголь активированный, отработанный при очистке абсорбента диоксида углерода на основе раствора карбоната калия при производстве аммиака",1,1,1,1,1,0
31414313494,"Уголь активированный, отработанный при очистке калиево-ванадиевого абсорбента в производстве аммиака",0,0,0,0,0,0
31414411494,"Катализатор медь-цинковый, отработанный при синтезе аммиака",0,0,0,0,0,0
31414811333,"Отходы зачистки оборудования синтеза аммиака, содержащие цинк",0,0,0,0,0,0
31420000000,"Отходы производства хлорида аммония, нитритов",0,0,0,0,0,0
31421000000,Отходы производства хлорида аммония,0,0,0,0,0,0
31422000000,Отходы производства нитритов,0,0,0,0,0,0
31422811294,Отходы зачистки оборудования производства нитрита натрия,0,0,0,0,0,0
31430000000,Отходы производства удобрений азотных минеральных или химических,0,0,0,0,0,0
31431000000,Отходы производства мочевины (карбамида),0,0,0,0,0,0
31432000000,Отходы производства сульфата аммония,0,0,0,0,0,0
31432500000,Отходы производства сульфата аммония из сернокислотного маточника акрилатных производств,0,0,0,0,0,0
31432511304,"Отходы производства сульфата аммония из сернокислотного маточника производства акриловых мономеров, содержащие органические примеси 10% и более",0,0,0,0,0,0
31433000000,Отходы производства нитрата аммония,0,0,0,0,0,0
31433731604,"Ткань фильтровальная из полимерных волокон, отработанная при газоочистке производства нитрата аммония (аммиачной селитры)",0,0,0,0,0,0
31433732604,"Ткань фильтровальная стекловолоконная, отработанная при очистке воздуха при производстве нитрата аммония (аммиачной селитры)",0,0,0,0,0,0
31433733604,"Ткань фильтровальная из полимерных волокон, загрязненная магнезитом в производстве нитрата аммония (аммиачной селитры)",0,0,0,0,0,0
31433811493,Отходы чистки оборудования обработки аммиачной селитры лиламином,0,0,0,0,0,0
31433821393,Отходы зачистки емкостей хранения раствора аммиачной селитры,0,0,0,0,0,0
31434000000,Отходы производства солей двойных и смеси нитратов кальция и нитрата аммония,0,0,0,0,0,0
31435000000,"Отходы производства смеси нитрата аммония с карбонатом кальция или прочими неорганическими веществами, не являющимися удобрениями",0,0,0,0,0,0
31438000000,Отходы производства удобрений азотных и смесей прочих,0,0,0,0,0,0
31439000000,Прочие отходы производства удобрений азотных минеральных или химических,0,0,0,0,0,0
31439011334,Отходы зачистки хранилищ жидких продуктов производства азотных удобрений,0,0,0,0,0,0
31439311393,Отходы фильтрации нитрит-нитратных щелоков при производстве нитрита натрия и нитрата натрия обезвоженные,0,0,0,0,0,0
31439711204,Отходы зачистки оборудования производства аммиачной селитры и карбамида,0,0,0,0,0,0
31440000000,Отходы производства удобрений фосфорных минеральных или химических,0,0,0,0,0,0
31441000000,Отходы производства суперфосфатов,0,0,0,0,0,0
31442000000,Отходы производства удобрений фосфатных прочих,0,0,0,0,0,0
31442891494,Сметки фосфорсодержащих удобрений,0,0,0,0,0,0
31450000000,Отходы производства удобрений калийных минеральных или химических,0,0,0,0,0,0
31451000000,Отходы производства хлорида калия,0,0,0,0,0,0
31451011613,"Ткань фильтровальная из полиэфирного волокна при газоочистке, загрязненная хлоридами калия и натрия",1,1,1,1,1,0
31452000000,Отходы производства сульфата калия,0,0,0,0,0,0
31453000000,Отходы производства удобрений калийных прочих,0,0,0,0,0,0
31460000000,Отходы производства нитрата натрия,0,0,0,0,0,0
31470000000,"Отходы производства удобрений, не вошедшие в другие группы",0,0,0,0,0,0
31471000000,"Отходы производства удобрений, содержащих три питательных элемента",0,0,0,0,0,0
31471001395,Отходы карбоната кальция при производстве нитроаммофоски на основе апатитового концентрата,0,0,0,0,0,0
31471005204,"Отходы конверсии нитрата кальция, образованного при разложении апатитового концентрата азотной кислотой в производстве нитроаммофоски, содержащие преимущественно карбонат кальция",0,0,0,0,0,0
31471011394,"Осадок при растворении сметок минеральных удобрений, содержащих азот, фосфор и калий",0,0,0,0,0,0
31471021434,"Опилки древесные, загрязненные минеральными удобрениями, содержащими азот, фосфор и калий",1,1,1,1,1,0
31471031603,"Ткань фильтровальная из синтетических волокон, отработанная при очистке воздуха от пыли апатита при производстве нитроаммофоски",0,0,0,0,0,0
31471032604,"Ткань фильтровальная из полимерных волокон, загрязненная хлористым калием при производстве нитроаммофоски",0,0,0,0,0,0
31471811394,Отходы зачистки оборудования нейтрализации азотнофосфорнокислого раствора аммиаком при производстве нитроаммофоски,0,0,0,0,0,0
31471812394,"Отходы зачистки оборудования производства нитроаммофоски, содержащие смесь солей аммония, карбоната кальция, фосфатов",0,0,0,0,0,0
31471814494,"Отходы зачистки оборудования производства нитроаммофоски, содержащие преимущественно хлорид калия",0,0,0,0,0,0
31471815493,Отходы зачистки емкостей хранения нитроаммофоски,0,0,0,0,0,0
31471821394,"Отходы (пульпа) промывки оборудования производства нитроаммофоски, содержащие карбонат кальция",0,0,0,0,0,0
31472000000,Отходы производства водородфосфат диаммония (диаммонийфосфата),0,0,0,0,0,0
31473000000,Отходы производства моноаммонийфосфата,0,0,0,0,0,0
31474000000,"Отходы производства удобрений, содержащих два питательных элемента",0,0,0,0,0,0
31475000000,"Отходы производства удобрений, содержащих два питательных элемента",0,0,0,0,0,0
31476000000,Отходы производства нитратов калия,0,0,0,0,0,0
31479000000,"Отходы производства удобрений минеральных или химических, содержащих два или три питательных элемента (азот, фосфор и калий), не вошедшие в другие группы",0,0,0,0,0,0
31480000000,"Отходы производства удобрений животного или растительного происхождения, не вошедшие в другие группы",0,0,0,0,0,0
31481000000,Отходы производства удобрений животного происхождения,0,0,0,0,0,0
31482000000,"Отходы производства удобрений растительного происхождения, не вошедшие в другие группы",0,0,0,0,0,0
31490000000,Отходы при очистке сточных вод производства удобрений и азотных соединений,0,0,0,0,0,0
31490131334,Отходы зачистки коллекторов ливневых и промышленных сточных вод при производстве неорганических минеральных удобрений,0,0,0,0,0,0
31499911394,Отходы очистки пруда-отстойника предварительно очищенных сточных вод производства минеральных удобрений,0,0,0,0,0,0
31500000000,Отходы производства пластмасс и синтетических смол в первичных формах,0,0,0,0,0,0
31501000000,Отходы при получении промежуточных продуктов для производства пластмасс и синтетических смол в первичных формах,0,0,0,0,0,0
31501031403,"Катализатор железооксидный, отработанный при дегидрировании диэтилбензола при получении дивинилбензола",0,0,0,0,0,0
31510000000,Отходы производства полимеров этилена в первичных формах,0,0,0,0,0,0
31510500000,Отходы получения хроморганических катализаторов для производства полиэтилена,0,0,0,0,0,0
31510510000,Отходы синтеза хромоцена,0,0,0,0,0,0
31510512203,Осадок при выделении фильтрацией хромоцена из реакционной массы на бумажном фильтре,0,0,0,0,0,0
31510513104,Водяной конденсат пропарки оборудования фильтрации хромоцена,0,0,0,0,0,0
31510514103,Отходы растворителей на основе толуола и тетрагидрофурана при промывке оборудования синтеза хромоцена,0,0,0,0,0,0
31510515392,Отходы зачистки фильтров очистки хромоцена после пропарки при синтезе хромоцена,0,0,0,0,0,0
31510520000,Отходы синтеза силилхромата,0,0,0,0,0,0
31510522202,Осадок при выделении фильтрацией силилхромата из реакционной массы на бумажном фильтре,0,0,0,0,0,0
31510524102,Отходы растворителей на основе гептана и четыреххлористого углерода при промывке оборудования синтеза силилхромата,0,0,0,0,0,0
31510525202,Отходы зачистки оборудования (смесителей) при синтезе силилхромата,0,0,0,0,0,0
31510530000,"Отходы получения катализаторов на основе оксида кремния, содержащие хромоцен",0,0,0,0,0,0
31510531103,"Растворители на основе толуола и изопентана, отработанные при получении катализатора на основе оксида кремния, содержащего хромоцен",0,0,0,0,0,0
31510532492,"Отходы зачистки оборудования получения катализатора на основе оксида кремния, содержащего хромоцен",0,0,0,0,0,0
31510533103,"Изопентан, отработанный при получении катализатора на основе оксида кремния, содержащего хромоцен",0,0,0,0,0,0
31510540000,"Отходы получения катализаторов на основе оксида кремния, содержащие силилхромат",0,0,0,0,0,0
31510541103,"Изопентан, отработанный при получении катализатора на основе оксида кремния, содержащего силилхромат и оксид алюминия",0,0,0,0,0,0
31510542492,"Отходы зачистки оборудования получения катализатора на основе оксида кремния, содержащего силилхромат и оксид алюминия",0,0,0,0,0,0
31510550000,Отходы получения катализаторов для производства полиэтилена,0,0,0,0,0,0
31510555104,Воды промывки оборудования получения катализаторов для производства полиэтилена,0,0,0,0,0,0
31510570000,Отходы очистки сточных вод при получении хроморганических катализаторов для производства полиэтилена,0,0,0,0,0,0
31510571202,"Отходы механической очистки сточных вод, загрязненных при получении хроморганических катализаторов для производства полиэтилена",0,0,0,0,0,0
31510581104,Воды промывки оборудования для получении хроморганических катализаторов в производстве полиэтилена,0,0,0,0,0,0
31511000000,Отходы производства полиэтилена,0,0,0,0,0,0
31511121204,Отходы грануляции полиэтилена в его производстве,0,0,0,0,0,0
31511521333,"Масла синтетические компрессорные, загрязненные низкомолекулярным полиэтиленом в производстве полиэтилена",0,0,0,0,0,0
31511621204,"Сетки стальные, загрязненные полиэтиленом при экструзии полиэтилена в его производстве",0,0,0,0,0,0
31511821203,Отходы зачистки сепараторов в производстве полиэтилена низкого давления,0,0,0,0,0,0
31511891414,"Пыль полиэтилена при очистке воздуха пневмотранспорта, узлов хранения, усреднения и отгрузки полиэтилена",0,0,0,0,0,0
31520000000,Отходы производства полимеров стирола в первичных формах,0,0,0,0,0,0
31521000000,Отходы производства полистирола,0,0,0,0,0,0
31521311203,"Адсорбент на основе оксида алюминия, отработанный при очистке стирола от пара-трет-бутилпирокатехина в производстве полистирола",0,0,0,0,0,0
31521800000,Отходы очистки сточных вод производства полимеров стирола в первичных формах,0,0,0,0,0,0
31521811394,Отходы полистирола при очистке сточных вод производства вспенивающегося полистирола,0,0,0,0,0,0
31522000000,Отходы производства сополимеров акрилонитрилбутадиенстирольных (абс-пластика) в первичных формах,0,0,0,0,0,0
31522811403,Отходы зачистки оборудования дозирования этиленбисстеарамида при производстве сополимеров акрилонитрилбутадиенстирольных (абс-пластика),0,0,0,0,0,0
31522812293,Отходы зачистки оборудования производства сополимеров акрилонитрилбутадиенстирольных (абс-пластика),0,0,0,0,0,0
31523000000,Отходы производства водных дисперсий сополимеров стирола,0,0,0,0,0,0
31523821204,Отходы бутил-акрилового сополимера стирола при зачистке оборудования полимеризации в производстве водных дисперсий сополимеров стирола,0,0,0,0,0,0
31530000000,Отходы производства полимеров винилхлорида и прочих галогенированных олефинов в первичных формах,0,0,0,0,0,0
31531000000,Отходы производства полимеров винилхлорида в первичных формах,0,0,0,0,0,0
31531100000,Отходы подготовки сырья и реагентов при производстве полимеров винилхлорида в первичных формах,0,0,0,0,0,0
31531111614,"Ткань фильтровальная хлопчатобумажная, отработанная при очистке жидкого винилхлорида при производстве поливинилхлорида",0,0,0,0,0,0
31531112514,Картридж полипропиленовый фильтра очистки растворов поливинилового спирта и гексаметафосфата натрия при производстве поливинилхлорида,1,1,1,1,1,0
31531113514,Картридж полипропиленовый фильтра очистки раствора поливинилового спирта при производстве поливинилхлорида,1,1,1,1,1,0
31531114514,Картридж полипропиленовый фильтра очистки раствора йодида калия при производстве поливинилхлорида,1,1,1,1,1,0
31531115614,Картридж бумажный фильтра очистки раствора карбоната натрия в производстве поливинилхлорида,0,0,0,0,0,0
31531121314,Отходы деструкции масла синтетического отработанного в синтезе инициатора полимеризации поливинилхлорида,1,1,1,1,1,0
31531122514,"Насадка скруббера полипропиленовая, отработанная при нейтрализации сдувок этилхлорформиата раствором каустической соды, при синтезе инициатора полимеризации винилхлорида",1,1,1,1,1,0
31531131294,Отходы фильтрации пара и конденсата пара с преимущественным содержанием оксидов железа при производстве поливинилхлорида,0,0,0,0,0,0
31531141514,"Тара полиэтиленовая, загрязненная реагентами производства поливинилхлорида",1,1,1,1,1,0
