FkkoCode,FkkoDescription,collection,disposal,placement,processing,transportation,utilization
3022120000,Отходы производства тканей из шерстяных волокон,0,0,0,0,0,0
10000000000,"Отходы сельского, лесного хозяйства, рыбоводства и рыболовства",0,0,0,0,0,0
11000000000,Отходы сельского хозяйства,0,0,0,0,0,0
11100000000,Отходы растениеводства,0,0,0,0,0,0
11101000000,Отходы от предпосевной подготовки семян,0,0,0,0,0,0
11101011495,"Семена зерновых, зернобобовых, масличных, овощных, бахчевых, корнеплодных культур непротравленные с истекшим сроком годности",0,0,0,0,0,0
11101021492,"Семена зерновых, зернобобовых, масличных, овощных, бахчевых, корнеплодных культур, протравленные фунгицидами и/или инсектицидами, с истекшим сроком годности",0,0,0,0,0,0
11101100000,Отходы от предпосевной подготовки семян зерновых культур,0,0,0,0,0,0
11101200000,Отходы от предпосевной подготовки семян зернобобовых культур,0,0,0,0,0,0
11101300000,Отходы от предпосевной подготовки семян масличных культур,0,0,0,0,0,0
11101301494,"Семена ярового рапса, протравленные инсектофунгицидами, отбракованные",0,0,0,0,0,0
11101302494,"Семена озимого рапса, протравленные инсектофунгицидами, отбракованные",0,0,0,0,0,0
11101311494,"Семена подсолнечника, протравленные инсектофунгицидами, отбракованные",0,0,0,0,0,0
11101400000,Отходы от предпосевной подготовки семян овощных культур,0,0,0,0,0,0
11101500000,Отходы от предпосевной подготовки семян бахчевых культур,0,0,0,0,0,0
11101600000,Отходы от предпосевной подготовки семян корнеплодных культур,0,0,0,0,0,0
11110000000,Отходы при выращивании зерновых и зернобобовых культур,0,0,0,0,0,0
11111000000,Отходы при уборке урожая зерновых и зернобобовых культур,0,0,0,0,0,0
11111001235,Мякина,0,0,0,0,0,0
11111002235,Солома,0,0,0,0,0,0
11111003235,Стебли подсолнечника,0,0,0,0,0,0
11111004235,Стебли кукурузы,0,0,0,0,0,0
11111540000,Отходы при механической обработке кукурузных початков,0,0,0,0,0,0
11111541235,Обертка кукурузных початков,0,0,0,0,0,0
11111542205,Стержни кукурузных початков,0,0,0,0,0,0
11111543405,Пленка стержневая при обмолоте початков кукурузы,0,0,0,0,0,0
11112000000,Отходы от механической очистки и сортировки зерна  (зерновые отходы),0,0,0,0,0,0
11112001495,Зерноотходы твердой пшеницы,0,0,0,0,0,0
11112002495,Зерноотходы мягкой пшеницы,0,0,0,0,0,0
11112003495,Зерноотходы меслина,0,0,0,0,0,0
11112004495,Зерноотходы кукурузы,0,0,0,0,0,0
11112005495,Зерноотходы ячменя,0,0,0,0,0,0
11112006495,Зерноотходы ржи,0,0,0,0,0,0
11112007495,Зерноотходы овса,0,0,0,0,0,0
11112008495,Зерноотходы сорго,0,0,0,0,0,0
11112009495,Зерноотходы проса,0,0,0,0,0,0
11112011495,Зерноотходы гречихи,0,0,0,0,0,0
11112012495,Зерноотходы тритикале,0,0,0,0,0,0
11112013495,Зерноотходы чумизы,0,0,0,0,0,0
11112014495,Зерноотходы прочих зерновых культур,0,0,0,0,0,0
11112015495,Зерноотходы прочих зернобобовых культур (овощей бобовых сушеных),0,0,0,0,0,0
11112800000,Отходы от механической очистки и сортировки зерна в смеси,0,0,0,0,0,0
11112811495,Отходы механической очистки зерновых культур в смеси,0,0,0,0,0,0
11113000000,Отходы механической очистки семян многолетних травянистых растений,0,0,0,0,0,0
11113011495,Отходы механической очистки семян многолетних бобовых трав,0,0,0,0,0,0
11120000000,"Отходы при выращивании овощей, бахчевых, корнеплодных и клубнеплодных культур",0,0,0,0,0,0
11121001235,"Ботва от корнеплодов, другие подобные растительные остатки при выращивании овощей",0,0,0,0,0,0
11121002235,"Ботва от корнеплодов, другие подобные растительные остатки при выращивании овощей, загрязненные землей",0,0,0,0,0,0
11130000000,Отходы при выращивании прочих однолетних культур,0,0,0,0,0,0
11131000000,Отходы при выращивании грибов,0,0,0,0,0,0
11131001235,Отходы тростника при выращивании грибов,0,0,0,0,0,0
11131811205,Отходы первичной обработки грибов с преимущественным содержанием грунта,0,0,0,0,0,0
11131812205,Отходы первичной обработки грибов с преимущественным содержанием растительных остатков,0,0,0,0,0,0
11140000000,Отходы при выращивании цветов в защищенном грунте,0,0,0,0,0,0
11141111235,"Растительные остатки при выращивании цветов, загрязненные землей",0,0,0,0,0,0
11190000000,Прочие отходы растениеводства,0,0,0,0,0,0
11191000000,Субстраты для тепличного растениеводства отработанные,0,0,0,0,0,0
11191111615,Субстраты минераловатные для тепличного растениеводства отработанные,0,0,0,0,0,0
11191511405,Субстрат торфяной для тепличного растениеводства отработанный,0,0,0,0,0,0
11197111405,Отходы зачистки оборудования для хранения зерна и уборки просыпей зерна в смеси,0,0,0,0,0,0
11198111395,Ил от зачистки оросительных каналов системы мелиорации земель,0,0,0,0,0,0
11200000000,Отходы животноводства,0,0,0,0,0,0
11210000000,Отходы разведения крупного рогатого скота,0,0,0,0,0,0
11211000000,Навоз крупного рогатого скота,0,0,0,0,0,0
11211001334,Навоз крупного рогатого скота свежий,0,0,0,0,0,0
11211002295,Навоз крупного рогатого скота перепревший,0,0,0,0,0,0
11212111204,Отходы подстилки из древесных опилок при содержании крупного рогатого скота,0,0,0,0,0,0
11220000000,Отходы разведения и содержания лошадей и прочих животных семейства лошадиных отряда непарнокопытных,0,0,0,0,0,0
11221000000,Навоз конский,0,0,0,0,0,0
11221001334,Навоз конский свежий,0,0,0,0,0,0
11221002295,Навоз конский перепревший,0,0,0,0,0,0
11222111405,Отходы подстилки из древесных опилок и стружки при содержании лошадей практически неопасные,0,0,0,0,0,0
11230000000,Отходы разведения верблюдов и прочих животных семейства верблюжьих,0,0,0,0,0,0
11231000000,Навоз верблюжий,0,0,0,0,0,0
11231001334,Навоз верблюжий свежий,0,0,0,0,0,0
11231002295,Навоз верблюжий перепревший,0,0,0,0,0,0
11240000000,Отходы разведения овец и коз,0,0,0,0,0,0
11241000000,Навоз мелкого рогатого скота,0,0,0,0,0,0
11241001294,Навоз мелкого рогатого скота свежий,0,0,0,0,0,0
11241002295,Навоз мелкого рогатого скота перепревший,0,0,0,0,0,0
11250000000,Отходы разведения свиней,0,0,0,0,0,0
11251000000,Навоз свиней,0,0,0,0,0,0
11251001333,Навоз свиней свежий,0,0,0,0,0,0
11251002294,Навоз свиней перепревший,0,0,0,0,0,0
11252001394,Отходы подстилки из древесных опилок при содержании свиней,0,0,0,0,0,0
11255111324,Жидкая фракция сепарации свиного навоза при самосплавной системе навозоудаления,0,0,0,0,0,0
11255112394,Твердая фракция сепарации свиного навоза при самосплавной системе навозоудаления,0,0,0,0,0,0
11255121324,Жидкая фракция сепарации свиного навоза при смывной системе навозоудаления,0,0,0,0,0,0
11255122394,Твердая фракция сепарации свиного навоза при смывной системе навозоудаления,0,0,0,0,0,0
11255211324,Навозосодержащие стоки при гидроудалении навоза свиней,0,0,0,0,0,0
11255212323,Стоки навозные при самосплавной системе навозоудаления свиней,0,0,0,0,0,0
11255311334,Осадок навозных стоков от свинарников при отстаивании в навозонакопителях,0,0,0,0,0,0
11270000000,Отходы разведения сельскохозяйственной птицы,0,0,0,0,0,0
11271000000,Помет птичий,0,0,0,0,0,0
11271101333,Помет куриный свежий,0,0,0,0,0,0
11271102294,Помет куриный перепревший,0,0,0,0,0,0
11271112294,"Помет куриный, выдержанный в пометохранилище, обеззараженный",0,0,0,0,0,0
11271201333,"Помет утиный, гусиный свежий",0,0,0,0,0,0
11271202294,"Помет утиный, гусиный перепревший",0,0,0,0,0,0
11271301333,Помет прочих птиц свежий,0,0,0,0,0,0
11271302294,Помет прочих птиц перепревший,0,0,0,0,0,0
11272000000,Отходы инкубаторов для птицеводства,0,0,0,0,0,0
11272111294,Скорлупа куриных яиц при инкубации цыплят бройлеров,0,0,0,0,0,0
11279000000,Прочие отходы разведения сельскохозяйственной птицы,0,0,0,0,0,0
11279101334,Отходы подстилки из древесных опилок при содержании птиц,0,0,0,0,0,0
11279102394,Отходы подстилки из соломы при содержании птиц,0,0,0,0,0,0
11279611415,Мука яичной скорлупы,0,0,0,0,0,0
11279800000,Отходы при очистке сточных вод на локальных очистных сооружениях при разведении сельскохозяйственной птицы,0,0,0,0,0,0
11279891394,"Осадок механической очистки сточных вод, образующихся при разведении сельскохозяйственной птицы",0,0,0,0,0,0
11279892394,"Смесь осадков биологической и флотационной очистки сточных вод, образующихся при разведении сельскохозяйственной птицы",0,0,0,0,0,0
11290000000,Отходы разведения и содержания животных прочие,0,0,0,0,0,0
11291000000,Отходы разведения животных в звероводческих хозяйствах и питомниках,0,0,0,0,0,0
11291100000,Навоз пушных зверей,0,0,0,0,0,0
11291101334,Навоз пушных зверей свежий,0,0,0,0,0,0
11291102295,Навоз пушных зверей перепревший,0,0,0,0,0,0
11291211404,Отходы подстилки из древесных опилок при содержании пушных зверей,0,0,0,0,0,0
11297000000,Отходы разведения и содержания собак,0,0,0,0,0,0
11297101334,Экскременты собак свежие,0,0,0,0,0,0
11297111404,Отходы подстилки из древесных опилок при содержании собак,0,0,0,0,0,0
11297121204,Отходы подстилки из сена при содержании собак,0,0,0,0,0,0
11297511324,Жидкие отходы смыва нечистот при уборке вольеров,0,0,0,0,0,0
11298000000,Отходы разведения сельскохозяйственных животных и птиц в смеси,0,0,0,0,0,0
11298111334,Смесь навоза сельскохозяйственных животных и птичьего помета свежих малоопасная,0,0,0,0,0,0
11299000000,Отходы содержания диких животных в неволе,0,0,0,0,0,0
11299111334,"Навоз диких животных, содержащихся в неволе, свежий",0,0,0,0,0,0
11299211304,Отходы подстилки из древесных опилок при содержании диких животных в неволе,0,0,0,0,0,0
11400000000,Отходы при прочих работах и услугах в сельском хозяйстве,0,0,0,0,0,0
11410000000,Отходы пестицидов и агрохимикатов,0,0,0,0,0,0
11411000000,"Отходы минеральных удобрений, утративших потребительские свойства",0,0,0,0,0,0
11411111494,"Удобрения минеральные азотные, утратившие потребительские свойства",1,1,1,1,1,0
11412000000,"Отходы пестицидов, утративших потребительские свойства",0,0,0,0,0,0
11412100000,"Отходы гербицидов, утративших потребительские свойства",0,0,0,0,0,0
11412165313,"Гербицид на основе флурохлоридона, утративший потребительские свойства",1,1,1,1,1,0
11412166313,"Гербицид на основе диметахлора, утративший потребительские свойства",0,0,0,0,0,0
11412200000,"Отходы инсектицидов, утративших потребительские свойства",0,0,0,0,0,0
11412291292,"Гексахлорановые дымовые шашки, утратившие потребительские свойства",0,0,0,0,0,0
11412300000,"Отходы фунгицидов, утративших потребительские свойства",0,0,0,0,0,0
11412311412,"Фундазол, утративший потребительские свойства",1,1,1,1,1,0
11412400000,"Отходы инсектофунгицидов, утративших потребительские свойства",0,0,0,0,0,0
11412800000,"Смеси пестицидов и агрохимикатов, утративших потребительские свойства",0,0,0,0,0,0
11412811302,"Смесь жидких пестицидов 2 - 3 классов опасности, пригодная для термического обезвреживания",0,0,0,0,0,0
11412812402,"Смесь твердых пестицидов 2 - 3 классов опасности, пригодная для термического обезвреживания",0,0,0,0,0,0
11412881711,"Пестициды на основе хлорорганических соединений в смеси, содержащие грунт и остатки упаковки",0,0,0,0,0,0
11412891711,"Отходы средств защиты растений неустановленного состава в смеси, содержащие грунт и остатки упаковки",0,0,0,0,0,0
11414000000,Прочие отходы средств ухода за растениями,0,0,0,0,0,0
11414100000,"Пестициды, запрещенные к использованию",0,0,0,0,0,0
11414111493,"Гербицид симазин, запрещенный к использованию",1,1,1,1,1,0
11419111494,"Отходы грунта, загрязненные гербицидом 2 класса опасности (содержание гербицида менее 3%)",1,1,1,1,1,0
11419711394,"Жидкие отходы мойки полов объектов хранения средств защиты растений, содержащие нефтепродукты (содержание нефтепродуктов менее 15%)",0,0,0,0,0,0
11420000000,"Корма для животных, утратившие потребительские свойства",0,0,0,0,0,0
11421000000,"Корма растительного происхождения, утратившие потребительские свойства",0,0,0,0,0,0
11421111495,"Фуражное зерно, утратившее потребительские свойства",0,0,0,0,0,0
11421121395,Отходы силоса,0,0,0,0,0,0
11421811205,"Смесь кормов растительного происхождения, утративших потребительские свойства",0,0,0,0,0,0
11421911395,"Остатки кормов с раздаточных столов коровников, утратившие потребительские свойства",0,0,0,0,0,0
15000000000,Отходы при лесоводстве и лесозаготовках,0,0,0,0,0,0
15100000000,Отходы при лесоводстве,0,0,0,0,0,0
15200000000,Отходы при лесозаготовках,0,0,0,0,0,0
15210000000,Отходы производства круглых лесоматериалов,0,0,0,0,0,0
15211000000,Отходы древесины от лесоразработок,0,0,0,0,0,0
15211001215,"Отходы сучьев, ветвей, вершинок от лесоразработок",0,0,0,0,0,0
15211002215,Отходы корчевания пней,0,0,0,0,0,0
15211003235,Зелень древесная,0,0,0,0,0,0
15211004215,Отходы раскряжевки,0,0,0,0,0,0
15410000000,Прочие отходы при лесоводстве и лесозаготовках,0,0,0,0,0,0
15411001215,"Отходы малоценной древесины (хворост, валежник, обломки стволов)",0,0,0,0,0,0
17000000000,"Отходы при рыболовстве, рыбоводстве",0,0,0,0,0,0
17110000000,Отходы при рыболовстве,0,0,0,0,0,0
17115000000,"Отходы первичной обработки кораллов, раковин и панцирей моллюсков, ракообразных, иглокожих",0,0,0,0,0,0
17115211205,Раковины рапан при их обработке,0,0,0,0,0,0
17115811495,Отходы переработки цист рачка артемии,0,0,0,0,0,0
17900000000,Отходы прочих видов деятельности при рыболовстве и рыбоводстве,0,0,0,0,0,0
17935111614,Отходы сетей и сетепошивочного материала из полиамидного волокна,0,0,0,0,0,0
20000000000,Отходы добычи полезных ископаемых,0,0,0,0,0,0
20010000000,Отходы проведения вскрышных работ при добыче полезных ископаемых,0,0,0,0,0,0
20011000000,Скальные вскрышные породы,0,0,0,0,0,0
20011001205,Скальные вскрышные породы силикатные практически неопасные,0,0,0,0,0,0
20011002205,Скальные вскрышные породы карбонатные практически неопасные,0,0,0,0,0,0
20011003205,Скальные вскрышные породы кремнистые практически неопасные,0,0,0,0,0,0
20011004205,Скальные вскрышные породы сульфатные практически неопасные,0,0,0,0,0,0
20011099205,Скальные вскрышные породы в смеси практически неопасные,0,0,0,0,0,0
20012000000,Рыхлые вскрышные породы,0,0,0,0,0,0
20012001405,Гравийно-галечные вскрышные породы практически неопасные,0,0,0,0,0,0
20012002405,Песчаные вскрышные породы практически неопасные,0,0,0,0,0,0
20012003405,Супесчаные вскрышные породы практически неопасные,0,0,0,0,0,0
20012099405,Рыхлые вскрышные породы в смеси практически неопасные,0,0,0,0,0,0
20013000000,Связные вскрышные породы,0,0,0,0,0,0
20013001395,Глинистые вскрышные породы практически неопасные,0,0,0,0,0,0
20013002395,Суглинистые вскрышные породы практически неопасные,0,0,0,0,0,0
20013099395,Связные вскрышные породы в смеси практически неопасные,0,0,0,0,0,0
20016121395,Вскрышная порода рыхлая при проведении вскрышных работ гидромеханизированным способом,0,0,0,0,0,0
20019000000,Прочие вскрышные породы,0,0,0,0,0,0
20019099395,Вскрышные породы в смеси практически неопасные,0,0,0,0,0,0
21000000000,Отходы добычи топливно-энергетических полезных ископаемых,0,0,0,0,0,0
21100000000,Отходы добычи и обогащения угля,0,0,0,0,0,0
21110000000,Отходы добычи угля открытым способом,0,0,0,0,0,0
21111111205,Вскрышная порода при добыче угля открытым способом,0,0,0,0,0,0
21111611395,Отходы извлечения угля из разубоженной породы противоточно-гравитационным методом,0,0,0,0,0,0
21120000000,"Отходы добычи антрацита, коксующегося, бурого и других видов угля подземным способом",0,0,0,0,0,0
21121101205,Вскрышная пустая порода при проходке стволов шахт добычи угля,0,0,0,0,0,0
21122111205,Вмещающая порода при добыче угля подземным способом,0,0,0,0,0,0
21128000000,Отходы очистки шахтных вод и иных вод при добыче и обогащении угля,0,0,0,0,0,0
21128001334,Шлам угольный от механической очистки шахтных вод малоопасный,0,0,0,0,0,0
21128111395,Осадок механической очистки карьерных вод при добыче угля,0,0,0,0,0,0
21128211205,Отходы очистки флотацией шахтных вод при добыче угля,0,0,0,0,0,0
21128811395,Осадок механической очистки сточных вод с отвала вскрышных пород при добыче угля,0,0,0,0,0,0
21128911395,"Осадок механической очистки смеси шахтных, карьерных, ливневых вод",0,0,0,0,0,0
21128921394,Осадок (ил) биологической очистки хозяйственно-бытовых и смешанных сточных вод при добыче угля,0,0,0,0,0,0
21130000000,"Отходы обогащения антрацита, коксующегося, бурого и других видов угля",0,0,0,0,0,0
21131000000,Отходы при дроблении и переработке угольного сырья,0,0,0,0,0,0
21131001495,Отсев каменного угля в виде крошки,0,0,0,0,0,0
21131002424,Пыль газоочистки каменноугольная,0,0,0,0,0,0
21132000000,Отходы обогащения угольного сырья флотационным методом,0,0,0,0,0,0
21132211405,Остаток обезвоживания шламовой пульпы при флотационном обогащении угольного сырья,0,0,0,0,0,0
