FkkoCode,FkkoDescription,collection,disposal,placement,processing,transportation,utilization
46885111723,"Лом изделий из стали, алюминия, меди, включая отходы кабелей",1,1,1,1,1,0
46952000000,Трубы стальные нефте- и газопроводов отработанные,0,0,0,0,0,0
46952111514,Трубы стальные газопроводов отработанные без изоляции,0,0,0,0,0,0
46952112514,Трубы стальные газопроводов отработанные с битумной изоляцией,0,0,0,0,0,0
46952113514,Трубы стальные газопроводов отработанные с полимерной изоляцией,0,0,0,0,0,0
46952212514,Трубы стальные нефтепроводов отработанные с битумной изоляцией,0,0,0,0,0,0
46952213514,Трубы стальные нефтепроводов отработанные с полимерной изоляцией,0,0,0,0,0,0
46953000000,"Трубы стальные инженерных коммуникаций (кроме нефте-, газопроводов) отработанные",0,0,0,0,0,0
46953211524,"Трубы стальные инженерных коммуникаций (кроме нефте-, газопроводов) с битумно-полимерной изоляцией отработанные",0,0,0,0,0,0
46954000000,"Трубы и иные изделия из металла, применяемые в бурении, при оборудовании (обустройстве) и эксплуатации нефтегазовых скважин, не включенные в другие группы",0,0,0,0,0,0
46954111514,"Трубы бурильные стальные отработанные, загрязненные нефтью (содержание нефти менее 15%)",0,0,0,0,0,0
46954121514,"Трубы насосно-компрессорные стальные отработанные, загрязненные нефтью (содержание нефти менее 15%)",0,0,0,0,0,0
46954211514,"Штанги насосные стальные отработанные, загрязненные нефтью (содержание нефти менее 15%)",0,0,0,0,0,0
47000000000,"Отходы оборудования и прочей продукции, подлежащей особому контролю",0,0,0,0,0,0
47100000000,"Отходы оборудования и прочей продукции, содержащих ртуть",0,0,0,0,0,0
47110000000,"Отходы электрического оборудования, содержащего ртуть",0,0,0,0,0,0
47110101521,"Лампы ртутные, ртутно-кварцевые, люминесцентные, утратившие потребительские свойства",1,1,1,1,1,0
47110211523,"Лампы амальгамные бактерицидные, утратившие потребительские свойства",0,0,0,0,0,0
47111101521,"Реле импульсные ртутьсодержащие, утратившие потребительские свойства",1,1,1,1,1,0
47111121521,"Прессостаты ртутьсодержащие, утратившие потребительские свойства",0,0,0,0,0,0
47112111531,"Элементы гальванические нормальные, содержащие сульфат кадмия, ртуть и ее соединения, утратившие потребительские свойства",1,1,1,1,1,0
47112112531,Отходы элементов и батарей ртутно-цинковых,1,1,1,1,1,0
47131111491,Бой стеклянный ртутных ламп и термометров с остатками ртути,1,1,1,1,1,0
47140000000,"Средства индивидуальной защиты, загрязненные ртутью",0,0,0,0,0,0
47141111521,Средства индивидуальной защиты органов дыхания от паров ртути и ртутьсодержащих соединений отработанные,0,0,0,0,0,0
47142111522,"Перчатки резиновые, загрязненные ртутью",0,0,0,0,0,0
47161111291,"Упаковка из полимерных материалов, загрязненная ртутью",1,1,1,1,1,0
47171111403,"Уголь активированный, загрязненный ртутью (содержание ртути менее 1%)",0,0,0,0,0,0
47181111101,"Ртуть, утратившая потребительские свойства в качестве рабочей жидкости",1,1,1,1,1,0
47190000000,"Отходы прочего оборудования, содержащего ртуть",0,0,0,0,0,0
47191000521,Отходы вентилей ртутных,1,1,1,1,1,0
47192000521,Отходы термометров ртутных,1,1,1,1,1,0
47193111521,"Детали приборов лабораторных, содержащие ртуть, утратившие потребительские свойства",1,1,1,1,1,0
47194111521,"Барометр ртутный, утративший потребительские свойства",1,1,1,1,1,0
47199111521,"Отходы вентилей, термометров, ламп ртутных, ртутно-кварцевых, люминесцентных в смеси, утративших потребительские свойства",1,1,1,1,1,0
47200000000,"Отходы оборудования и прочей продукции, содержащих галогенированные ароматические органические вещества, в том числе стойкие органические загрязнители",0,0,0,0,0,0
47210000000,"Отходы оборудования и прочей продукции, содержащих стойкие органические загрязнители",0,0,0,0,0,0
47211000000,"Отходы конденсаторов, содержащих стойкие органические загрязнители",0,0,0,0,0,0
47211001521,Отходы конденсаторов с трихлордифенилом,1,1,1,1,1,0
47211002521,Отходы конденсаторов с пентахлордифенилом,1,1,1,1,1,0
47212000000,"Отходы трансформаторов, содержащих стойкие органические загрязнители",0,0,0,0,0,0
47212001521,Отходы трансформаторов с пентахлордифенилом,1,1,1,1,1,0
47215000000,"Отходы прочего оборудования, содержащего стойкие органические загрязнители",0,0,0,0,0,0
47216000000,"Отходы масел, содержащих стойкие органические загрязнители",0,0,0,0,0,0
47216001311,"Отходы масел трансформаторных, содержащих полихлорированные дифенилы и терфенилы",1,1,1,1,1,0
47216011101,"Отходы масел трансформаторных, содержащих полихлорированные дифенилы и трихлорбензол",1,1,1,1,1,0
47216099311,"Отходы прочих масел, содержащих полихлорированные дифенилы и терфенилы",1,1,1,1,1,0
47219000000,"Отходы прочей продукции, содержащей стойкие органические загрязнители",0,0,0,0,0,0
47230000000,"Отходы масел, содержащих галогены",0,0,0,0,0,0
47230101312,"Отходы масел трансформаторных и теплонесущих, содержащих галогены",1,1,1,1,1,0
47230201312,"Отходы масел гидравлических, содержащих галогены",1,1,1,1,1,0
47290000000,"Отходы прочей продукции, содержащей галогенированные ароматические органические вещества",0,0,0,0,0,0
47300000000,"Отходы оборудования, содержащего озоноразрушающие вещества",0,0,0,0,0,0
47380000000,"Отходы химической продукции, содержащей озоноразрушающие вещества",0,0,0,0,0,0
47381111102,Отходы растворителей на основе тетрахлорметана,0,0,0,0,0,0
48000000000,Отходы машин и прочего оборудования,0,0,0,0,0,0
48100000000,"Оборудование компьютерное, электронное, оптическое, утратившее потребительские свойства",0,0,0,0,0,0
48110000000,"Компоненты электронные и платы, утратившие потребительские свойства",0,0,0,0,0,0
48111911724,Отходы электронных компонентов в смеси с преимущественным содержанием железа,1,1,1,1,1,0
48112111524,"Платы электронные компьютерные, утратившие потребительские свойства",1,1,1,1,1,0
48112191524,"Платы электронные (кроме компьютерных), утратившие потребительские свойства",1,1,1,1,1,0
48113111524,"Диски магнитные жесткие компьютерные, утратившие потребительские свойства",1,1,1,1,1,0
48120000000,"Компьютеры и периферийное оборудование, утратившие потребительские свойства",0,0,0,0,0,0
48120101524,"Системный блок компьютера, утративший потребительские свойства",1,1,1,1,1,0
48120201524,"Принтеры, сканеры, многофункциональные устройства (мфу), утратившие потребительские свойства",1,1,1,1,1,0
48120211524,"Проекторы, подключаемые к компьютеру, утратившие потребительские свойства",1,1,1,1,1,0
48120301523,Картриджи печатающих устройств с содержанием тонера 7% и более отработанные,1,1,1,1,1,0
48120302524,Картриджи печатающих устройств с содержанием тонера менее 7% отработанные,1,1,1,1,1,0
48120351523,Картриджи 3d-принтеров с остатками акриловых фотополимеров отработанные,1,1,1,1,1,0
48120401524,"""клавиатура, манипулятор """"мышь"""" с соединительными проводами, утратившие потребительские свойства""",1,1,1,1,1,0
48120501524,"Мониторы компьютерные плазменные, утратившие потребительские свойства",1,1,1,1,1,0
48120502524,"Мониторы компьютерные жидкокристаллические, утратившие потребительские свойства",1,1,1,1,1,0
48120503524,"Мониторы компьютерные электроннолучевые, утратившие потребительские свойства",1,1,1,1,1,0
48120611524,"Компьютеры портативные (ноутбуки), утратившие потребительские свойства",1,1,1,1,1,0
48120711524,"Компьютер-моноблок, утративший потребительские свойства",1,1,1,1,1,0
48120911524,"Информационно-платежный терминал, утративший потребительские свойства",1,1,1,1,1,0
48120913524,"Электронное программно-техническое устройство для приема к оплате платежных карт (pos-терминал), утратившее потребительские свойства",1,1,1,1,1,0
48120915524,"Банкомат, утративший потребительские свойства",1,1,1,1,1,0
48120917524,"Электронный кассир, утративший потребительские свойства",0,0,0,0,0,0
48121102532,"Источники бесперебойного питания, утратившие потребительские свойства",1,1,1,1,1,0
48130000000,"Оборудование коммуникационное, утратившее потребительские свойства",0,0,0,0,0,0
48132000000,"Оборудование оконечное (пользовательское) телефонной или телеграфной связи, аппаратура видеосвязи, утратившие потребительские свойства",0,0,0,0,0,0
48132101524,"Телефонные и факсимильные аппараты, утратившие потребительские свойства",1,1,1,1,1,0
48132211523,"Телефоны мобильные, утратившие потребительские свойства",1,1,1,1,1,0
48132221524,"Рации портативные, утратившие потребительские свойства",1,1,1,1,1,0
48132311524,"Модемы, утратившие потребительские свойства",1,1,1,1,1,0
48133000000,"""аппаратура коммуникационная, аппаратура радио- или телевизионная передающая  телевизионные камеры, утратившие потребительские свойства""",0,0,0,0,0,0
48133111524,"Коммутаторы, концентраторы сетевые, утратившие потребительские свойства",1,1,1,1,1,0
48133112524,"Коммутаторы, маршрутизаторы сетевые, утратившие потребительские свойства",1,1,1,1,1,0
48133211524,"Тюнеры, модемы, серверы, утратившие потребительские свойства",1,1,1,1,1,0
48133511524,"Оборудование автоматических телефонных станций, утратившее потребительские свойства",0,0,0,0,0,0
48133811524,"Радиостанции для железнодорожного транспорта, утратившие потребительские свойства",0,0,0,0,0,0
48133812524,"Приборы и блоки установок поездного радиовещания, утратившие потребительские свойства",0,0,0,0,0,0
48136000000,"Антенны и антенные отражатели всех видов и их части, утратившие потребительские свойства; части передающей радио- и телевизионной аппаратуры и телевизионных камер, утратившие потребительские свойства",0,0,0,0,0,0
48136311524,"Антенна, состоящая преимущественно из алюминиевых деталей, утратившая потребительские свойства",0,0,0,0,0,0
48140000000,"Техника бытовая электронная, утратившая потребительские свойства",0,0,0,0,0,0
48141000000,"Радиоприемники широковещательные, утратившие потребительские свойства",0,0,0,0,0,0
48142000000,"Приемники телевизионные, совмещенные или не совмещенные с широковещательными радиоприемниками или аппаратурой для записи или воспроизведения звука или изображения, утратившие потребительские свойства",0,0,0,0,0,0
48143000000,"Аппаратура для записи и воспроизведения звука и изображения, утратившая потребительские свойства",0,0,0,0,0,0
48143100000,"Устройства электропроигрывающие, проигрыватели грампластинок, кассетные проигрыватели и прочая аппаратура для воспроизведения, утратившие потребительские свойства",0,0,0,0,0,0
48143132524,"Видеоплееры, утратившие потребительские свойства",0,0,0,0,0,0
48143151524,"Dvd-проигрыватели стационарные и переносные, утратившие потребительские свойства",0,0,0,0,0,0
48143191524,"Музыкальные центры, в том числе с функцией караоке, утратившие потребительские свойства",0,0,0,0,0,0
48143200000,"Магнитофоны и прочая аппаратура для записи звука, утратившие потребительские свойства",0,0,0,0,0,0
48143210000,"Магнитофоны, утратившие потребительские свойства",0,0,0,0,0,0
48143211524,"Магнитофоны бытовые, утратившие потребительские свойства",0,0,0,0,0,0
48143220000,"Диктофоны, утратившие потребительские свойства",0,0,0,0,0,0
48143221524,"Диктофоны профессиональные, утратившие потребительские свойства",1,1,1,1,1,0
48143290000,"Аппаратура для записи звука прочая, утратившая потребительские свойства",0,0,0,0,0,0
48143300000,"Видеокамеры для записи и прочая аппаратура для записи или воспроизведения изображения, утратившие потребительские свойства",0,0,0,0,0,0
48143311524,"Видеокамеры бытовые, утратившие потребительские свойства",0,0,0,0,0,0
48143351524,"Видеомагнитофоны бытовые, утратившие потребительские свойства",0,0,0,0,0,0
48143381524,"Видеорегистраторы автомобильные, утратившие потребительские свойства",0,0,0,0,0,0
48143391524,"Датчики и камеры автоматических систем охраны и видеонаблюдения, утратившие потребительские свойства",1,1,1,1,1,0
48143400000,"Мониторы и проекторы, без встроенной телевизионной приемной аппаратуры и, в основном, не используемые в системах автоматической обработки данных, утратившие потребительские свойства",0,0,0,0,0,0
48143410000,"Мониторы, не предназначенные специально для использования в качестве периферийного оборудования, утратившие потребительские свойства",0,0,0,0,0,0
48143420000,"Проекторы без приемных устройств, не предназначенные специально для использования в качестве периферийного оборудования, утратившие потребительские свойства",0,0,0,0,0,0
48144000000,"Микрофоны, громкоговорители, приемная аппаратура для радиотелефонной или радиотелеграфной связи, утратившие потребительские свойства",0,0,0,0,0,0
48145000000,"Части звукового и видеооборудования, утратившие потребительские свойства",0,0,0,0,0,0
48146000000,"Приставки игровые, используемые с телевизионным приемником или оборудованные встроенным экраном, и прочие коммерческие и азартные игры с электронным дисплеем, утратившие потребительские свойства",0,0,0,0,0,0
48150000000,"""оборудование для измерения, испытаний и навигации  часы всех видов, утратившие потребительские свойства""",0,0,0,0,0,0
48155311524,"Барометры, утратившие потребительские свойства",1,1,1,1,1,0
48158111524,"Часы настенные, утратившие потребительские свойства",0,0,0,0,0,0
48159111523,"Системы обнаружения делящихся и радиоактивных материалов стационарные таможенные, утратившие потребительские свойства",0,0,0,0,0,0
48160000000,"Оборудование для облучения, электрическое диагностическое и терапевтическое, применяемые в медицинских целях, утратившее потребительские свойства",0,0,0,0,0,0
48165111524,"Бактерицидный облучатель закрытого типа, утративший потребительские свойства",0,0,0,0,0,0
48170000000,"Приборы оптические и фотографическое оборудование, утратившие потребительские свойства",0,0,0,0,0,0
48180000000,"Носители информации магнитные и оптические, утратившие потребительские свойства",0,0,0,0,0,0
48190000000,"Прочие отходы оборудования, утратившего потребительские свойства",0,0,0,0,0,0
48200000000,"Оборудование электрическое, утратившее потребительские свойства",0,0,0,0,0,0
48210000000,"Электродвигатели, генераторы, трансформаторы и электрическая распределительная и контрольно-измерительная аппаратура, утратившие потребительские свойства",0,0,0,0,0,0
48215111524,"Счетчики электрические, утратившие потребительские свойства",0,0,0,0,0,0
48220000000,"Батареи и аккумуляторы, утратившие потребительские свойства, кроме аккумуляторов для транспортных средств, вошедших в блок 9",0,0,0,0,0,0
48220101532,Химические источники тока литиевые тионилхлоридные неповрежденные отработанные,1,1,1,1,1,0
48220111532,Химические источники тока марганцово-цинковые щелочные неповрежденные отработанные,0,1,0,0,0,0
48220121532,Химические источники тока никель-металлгидридные неповрежденные отработанные,1,1,1,1,1,0
48220131532,Отходы литий-ионных аккумуляторов неповрежденных,1,1,1,1,1,0
48220141523,Тепловые источники тока первичные литиевые неповрежденные отработанные,0,0,0,0,0,0
48220145532,Химические источники тока первичные диоксидмарганцевые литиевые неповрежденные отработанные,0,0,0,0,0,0
48220151532,Одиночные гальванические элементы (батарейки) никель-кадмиевые неповрежденные отработанные,1,1,1,1,1,0
48221102532,Аккумуляторы компьютерные кислотные неповрежденные отработанные,1,1,1,1,1,0
48221111532,"Аккумуляторы стационарные свинцово-кислотные, утратившие потребительские свойства",1,1,1,1,1,0
48221121532,"Аккумуляторы для портативной техники и устройств свинцово-кислотные, утратившие потребительские свойства",0,0,0,0,0,0
48221211532,"Аккумуляторные батареи источников бесперебойного питания свинцово-кислотные, утратившие потребительские свойства, с электролитом",1,1,1,1,1,0
48221212522,"Аккумуляторные батареи источников бесперебойного питания свинцово-кислотные, утратившие потребительские свойства, без электролита",1,1,1,1,1,0
48223111522,"Элементы литиевых аккумуляторных батарей, утратившие потребительские свойства",1,1,1,1,1,0
